{"schema_version":"1.0.0","scenario_id":"scenario_launch","scenario_version_id":"scenario_launch:v1","plan_hash":"aaaaaaaaaaaaaaaaaaaaaaaaaaaaaaaaaaaaaaaaaaaaaaaaaaaaaaaaaaaaaaaa","execution_order":["research","draft","finalize"],"work_orders":[{"node_id":"research","assignee_agent_id":"researcher-001","role":"executor","dependency_ids":[],"budget":{"max_input_tokens":4000,"max_output_tokens":2000,"max_tool_rounds":4,"max_elapsed_ms":120000}},{"node_id":"draft","assignee_agent_id":"writer-002","role":"executor","dependency_ids":["research"],"budget":{"max_input_tokens":4000,"max_output_tokens":2000,"max_tool_rounds":4,"max_elapsed_ms":120000}},{"node_id":"finalize","assignee_agent_id":"researcher-001","role":"finalization","dependency_ids":["draft"],"budget":{"max_input_tokens":4000,"max_output_tokens":2000,"max_tool_rounds":2,"max_elapsed_ms":120000}}],"blocking_issues":[]}
